{
  "artifact_id": "V0_OSAP_GATE3_CLUSTER_B_WP0_DEVELOPMENT_BRANCH_SYNCHRONIZATION_RECORD",
  "version": "0.1",
  "date": "2026-07-20",
  "repository": "olegovation-ship-it/v0-osap-formal-core",
  "main_branch": "main",
  "development_branch": "v1.4.0-development",
  "sync_mode": "FAST_FORWARD_ONLY",
  "baseline_merge_commit": "46c02d96c047e70fe0d54feb60a0aadce2de95c7",
  "pre_sync_development_tip": "df4f8524b26e13eda34f96ff8ff48124a7cf9db0",
  "observed_main_tip": "46c02d96c047e70fe0d54feb60a0aadce2de95c7",
  "current_main_tip": "46c02d96c047e70fe0d54feb60a0aadce2de95c7",
  "current_development_tip": "9a32b604097364d1c3aa97450ae15b19619ba771",
  "compare_status": "ahead",
  "ahead_by": 0,
  "behind_by": 0,
  "relation": "DEVELOPMENT_AHEAD_WITH_CLOSEOUT_PATCH",
  "status": "FINAL_FAST_FORWARD_REQUIRED",
  "history_rewrite_authorized": false,
  "force_push_authorized": false,
  "branch_deletion_authorized": false,
  "final_sync_required_after_closeout_merge": true
}
